{
  "schema_version": 1,
  "run_id": "ghj-dev-search-v1-016",
  "created_at": "2026-10-27T05:00:36.618776+00:00",
  "owner": "ghj",
  "method_id": "fedprox_u_uniform",
  "parent_method": null,
  "hypothesis_id": null,
  "supersedes": null,
  "git_commit": "0d52ff1f26116ea986ecf9671f8dda24408bd5c2",
  "protocol_hash": "c8c43da022a5728c5e0cc41b22d07e66cc8a66c279a1f1b1f1777a175b8e5ba0",
  "data_hash": "f3382a029de9e2179f545bc5e8d2f1b87a2ea798dd06e2b473cf6bcc7f6d9702",
  "config_hash": "32316e28ca085340f126f520b0f1a40d4a22597ad8120de811eed2a15463b2a7",
  "cost_hash": "03339fbc5db9027f60d28a34a966009734e8a468d710c310f635134657d411ea",
  "scenario": "natural_heterogeneous",
  "seed": 11,
  "stage": "development",
  "evaluation_scope": "search_validation",
  "fidelity": "full",
  "budget_sim_seconds": 9.836224400345905,
  "status": "complete",
  "mean_client_macro_f1": 0.883671406208171,
  "j_dev": 0.883671406208171,
  "sim_seconds_used": 9.813121590340277,
  "wall_seconds": 6.858935400000064,
  "up_bytes": 19794078,
  "down_bytes": 19716894,
  "completed_rounds": 201,
  "artifact_uri": "artifacts/ghj-dev-search-v1-016/artifacts.zip",
  "artifact_sha256": "1e12764e5b0af99b02afd39fa099897cbc6e0cc303265f6d80a0a70d3e171d70",
  "environment": {
    "python": "3.11.17",
    "platform": "Windows-10-10.0.26200-SP0",
    "machine": "AMD64",
    "implementation": "CPython",
    "uv": "0.12.23",
    "uv_lock_sha256": "7432b959216b96250340cd0c256a54d203fcb042c6d33576f9361b8a606aa61a",
    "runtime_config_sha256": "db2915a8ffc49ae52cd862915fbb5979ce3f6d227368949db509e769fc93743d",
    "profile": "cpu-v1",
    "installed_distributions": {
      "Jinja2": "3.1.6",
      "MarkupSafe": "3.0.4",
      "cloudpickle": "3.1.2",
      "edgefl-client-selection": "0.1.0",
      "filelock": "4.2.4",
      "fsspec": "2026.9.0",
      "joblib": "1.6.0",
      "mpmath": "1.3.0",
      "narwhals": "2.27.1",
      "networkx": "3.6.1",
      "numpy": "2.4.6",
      "scikit-learn": "1.9.1",
      "scipy": "1.17.1",
      "setuptools": "84.2.0",
      "sympy": "1.14.0",
      "threadpoolctl": "3.7.0",
      "torch": "2.14.1+cpu",
      "typing_extensions": "4.16.0"
    }
  },
  "error": null
}
