{
  "schema_version": 1,
  "run_id": "ghj-dev-conditions-v2-007",
  "created_at": "2026-10-27T05:12:18.938900+00:00",
  "owner": "ghj",
  "method_id": "fedavg_u_uniform",
  "parent_method": null,
  "hypothesis_id": null,
  "supersedes": null,
  "git_commit": "51b2cec2e529a2ceb2ba0ba8f8b4664a3ca5015b",
  "protocol_hash": "aa3551b6b85b6074adcac1786f587a728a0d62fc3e041c4c4e6625b2d3be2fc0",
  "data_hash": "f3382a029de9e2179f545bc5e8d2f1b87a2ea798dd06e2b473cf6bcc7f6d9702",
  "config_hash": "421924c74107d4546ea9390cd8ea8afe8ef91e0605da2ea73a726d0e940ca769",
  "cost_hash": "716297de38d863e65e0caa41717c433aff9d7d4ee9e286587844e6eda7be3ed8",
  "scenario": "natural_homogeneous",
  "seed": 11,
  "stage": "development",
  "evaluation_scope": "search_validation",
  "fidelity": "full",
  "budget_sim_seconds": 9.836224400345905,
  "status": "complete",
  "mean_client_macro_f1": 0.9032177857545506,
  "j_dev": 0.9032177857545506,
  "sim_seconds_used": 9.817698660035921,
  "wall_seconds": 5.219565200000034,
  "up_bytes": 28952532,
  "down_bytes": 28839636,
  "completed_rounds": 294,
  "artifact_uri": "artifacts/ghj-dev-conditions-v2-007/artifacts.zip",
  "artifact_sha256": "d988c7bbfcb1840f6eacef66842f117944005be20a83525ce40b72b3f1ec3378",
  "environment": {
    "python": "3.11.17",
    "platform": "Windows-10-10.0.26200-SP0",
    "machine": "AMD64",
    "implementation": "CPython",
    "uv": "0.12.23",
    "uv_lock_sha256": "7432b959216b96250340cd0c256a54d203fcb042c6d33576f9361b8a606aa61a",
    "runtime_config_sha256": "db2915a8ffc49ae52cd862915fbb5979ce3f6d227368949db509e769fc93743d",
    "profile": "cpu-v1",
    "installed_distributions": {
      "Jinja2": "3.1.6",
      "MarkupSafe": "3.0.4",
      "cloudpickle": "3.1.2",
      "edgefl-client-selection": "0.1.0",
      "filelock": "4.2.4",
      "fsspec": "2026.9.0",
      "joblib": "1.6.0",
      "mpmath": "1.3.0",
      "narwhals": "2.27.1",
      "networkx": "3.6.1",
      "numpy": "2.4.6",
      "scikit-learn": "1.9.1",
      "scipy": "1.17.1",
      "setuptools": "84.2.0",
      "sympy": "1.14.0",
      "threadpoolctl": "3.7.0",
      "torch": "2.14.1+cpu",
      "typing_extensions": "4.16.0"
    }
  },
  "error": null
}
